{
  "schemaVersion": 3,
  "modelStandard": { "name": "workspace-launcher-pet", "version": 1, "profile": "full-state-22" },
  "id": "example-full-pet",
  "displayName": "Example Full Pet",
  "description": "Replace this metadata, keep the state IDs, rows, geometry, and semantic bindings.",
  "render": {
    "engine": "sprite2d",
    "canvas": { "mode": "fixed", "width": 192, "height": 208 },
    "animations": {
      "idle": { "source": { "type": "atlas", "asset": "spritesheet.webp", "columns": 8, "rows": 22, "cellWidth": 192, "cellHeight": 208, "row": 0, "startColumn": 0, "frameCount": 8 }, "timing": { "fps": 6, "playback": "loop" }, "semantics": ["idle", "ambient.breathing", "event.startup"], "interruptible": true },
      "running-right": { "source": { "type": "atlas", "asset": "spritesheet.webp", "columns": 8, "rows": 22, "cellWidth": 192, "cellHeight": 208, "row": 1, "startColumn": 0, "frameCount": 8 }, "timing": { "fps": 10, "playback": "loop" }, "semantics": ["move.walk.right"], "interruptible": true },
      "running-left": { "source": { "type": "atlas", "asset": "spritesheet.webp", "columns": 8, "rows": 22, "cellWidth": 192, "cellHeight": 208, "row": 2, "startColumn": 0, "frameCount": 8 }, "timing": { "fps": 10, "playback": "loop" }, "semantics": ["move.walk.left"], "interruptible": true },
      "waving": { "source": { "type": "atlas", "asset": "spritesheet.webp", "columns": 8, "rows": 22, "cellWidth": 192, "cellHeight": 208, "row": 3, "startColumn": 0, "frameCount": 8 }, "timing": { "fps": 8, "playback": "once" }, "semantics": ["greet", "touch.head", "event.hover"], "interruptible": true },
      "jumping": { "source": { "type": "atlas", "asset": "spritesheet.webp", "columns": 8, "rows": 22, "cellWidth": 192, "cellHeight": 208, "row": 4, "startColumn": 0, "frameCount": 8 }, "timing": { "fps": 10, "playback": "once" }, "semantics": ["react.excited"], "interruptible": true },
      "failed": { "source": { "type": "atlas", "asset": "spritesheet.webp", "columns": 8, "rows": 22, "cellWidth": 192, "cellHeight": 208, "row": 5, "startColumn": 0, "frameCount": 8 }, "timing": { "fps": 6, "playback": "once" }, "semantics": ["error", "event.task_failure"], "interruptible": true },
      "waiting": { "source": { "type": "atlas", "asset": "spritesheet.webp", "columns": 8, "rows": 22, "cellWidth": 192, "cellHeight": 208, "row": 6, "startColumn": 0, "frameCount": 8 }, "timing": { "fps": 5, "playback": "loop" }, "semantics": ["rest.sit", "wait.user", "event.wait_user"], "interruptible": true },
      "running": { "source": { "type": "atlas", "asset": "spritesheet.webp", "columns": 8, "rows": 22, "cellWidth": 192, "cellHeight": 208, "row": 7, "startColumn": 0, "frameCount": 8 }, "timing": { "fps": 8, "playback": "loop" }, "semantics": ["focus.working", "event.task_assigned"], "interruptible": true },
      "review": { "source": { "type": "atlas", "asset": "spritesheet.webp", "columns": 8, "rows": 22, "cellWidth": 192, "cellHeight": 208, "row": 8, "startColumn": 0, "frameCount": 8 }, "timing": { "fps": 6, "playback": "loop" }, "semantics": ["study.review", "emotion.focused", "event.task_review"], "interruptible": true },
      "look-row-9": { "source": { "type": "atlas", "asset": "spritesheet.webp", "columns": 8, "rows": 22, "cellWidth": 192, "cellHeight": 208, "row": 9, "startColumn": 0, "frameCount": 8 }, "timing": { "fps": 8, "playback": "loop" }, "semantics": ["emotion.curious", "look.clockwise.upper"], "interruptible": true },
      "look-row-10": { "source": { "type": "atlas", "asset": "spritesheet.webp", "columns": 8, "rows": 22, "cellWidth": 192, "cellHeight": 208, "row": 10, "startColumn": 0, "frameCount": 8 }, "timing": { "fps": 8, "playback": "loop" }, "semantics": ["look.clockwise.lower"], "interruptible": true },
      "picked-up": { "source": { "type": "atlas", "asset": "spritesheet.webp", "columns": 8, "rows": 22, "cellWidth": 192, "cellHeight": 208, "row": 11, "startColumn": 0, "frameCount": 8 }, "timing": { "fps": 8, "playback": "once" }, "semantics": ["interaction.lift", "event.drag_start", "emotion.surprised"], "interruptible": false },
      "dragging-left": { "source": { "type": "atlas", "asset": "spritesheet.webp", "columns": 8, "rows": 22, "cellWidth": 192, "cellHeight": 208, "row": 12, "startColumn": 0, "frameCount": 8 }, "timing": { "fps": 10, "playback": "loop" }, "semantics": ["interaction.drag.left", "event.drag_dx_negative"], "interruptible": false },
      "dragging-right": { "source": { "type": "atlas", "asset": "spritesheet.webp", "columns": 8, "rows": 22, "cellWidth": 192, "cellHeight": 208, "row": 13, "startColumn": 0, "frameCount": 8 }, "timing": { "fps": 10, "playback": "loop" }, "semantics": ["interaction.drag.right", "event.drag_dx_positive"], "interruptible": false },
      "drag-hold": { "source": { "type": "atlas", "asset": "spritesheet.webp", "columns": 8, "rows": 22, "cellWidth": 192, "cellHeight": 208, "row": 14, "startColumn": 0, "frameCount": 8 }, "timing": { "fps": 6, "playback": "loop" }, "semantics": ["interaction.drag", "interaction.drag.hold", "event.drag_stationary"], "interruptible": false },
      "falling": { "source": { "type": "atlas", "asset": "spritesheet.webp", "columns": 8, "rows": 22, "cellWidth": 192, "cellHeight": 208, "row": 15, "startColumn": 0, "frameCount": 8 }, "timing": { "fps": 10, "playback": "once" }, "semantics": ["interaction.release", "event.drag_release"], "interruptible": false },
      "landing": { "source": { "type": "atlas", "asset": "spritesheet.webp", "columns": 8, "rows": 22, "cellWidth": 192, "cellHeight": 208, "row": 16, "startColumn": 0, "frameCount": 8 }, "timing": { "fps": 10, "playback": "once" }, "semantics": ["interaction.land", "event.landed"], "interruptible": false },
      "sleep": { "source": { "type": "atlas", "asset": "spritesheet.webp", "columns": 8, "rows": 22, "cellWidth": 192, "cellHeight": 208, "row": 17, "startColumn": 0, "frameCount": 8 }, "timing": { "fps": 4, "playback": "loop" }, "semantics": ["rest.sleep", "emotion.sleepy", "event.sleep_timeout"], "interruptible": true },
      "wake-up": { "source": { "type": "atlas", "asset": "spritesheet.webp", "columns": 8, "rows": 22, "cellWidth": 192, "cellHeight": 208, "row": 18, "startColumn": 0, "frameCount": 8 }, "timing": { "fps": 8, "playback": "once" }, "semantics": ["rest.wake", "event.wake"], "interruptible": true },
      "happy": { "source": { "type": "atlas", "asset": "spritesheet.webp", "columns": 8, "rows": 22, "cellWidth": 192, "cellHeight": 208, "row": 19, "startColumn": 0, "frameCount": 8 }, "timing": { "fps": 8, "playback": "once" }, "semantics": ["react.happy", "emotion.happy", "event.click", "event.task_success"], "interruptible": true },
      "angry": { "source": { "type": "atlas", "asset": "spritesheet.webp", "columns": 8, "rows": 22, "cellWidth": 192, "cellHeight": 208, "row": 20, "startColumn": 0, "frameCount": 8 }, "timing": { "fps": 8, "playback": "once" }, "semantics": ["react.angry", "react.annoyed", "emotion.angry", "emotion.annoyed"], "interruptible": true },
      "sad": { "source": { "type": "atlas", "asset": "spritesheet.webp", "columns": 8, "rows": 22, "cellWidth": 192, "cellHeight": 208, "row": 21, "startColumn": 0, "frameCount": 8 }, "timing": { "fps": 6, "playback": "once" }, "semantics": ["react.sad", "react.concerned", "emotion.sad", "emotion.concerned"], "interruptible": true }
    }
  },
  "semantics": {
    "bindings": {
      "idle": ["idle"], "micro.blink": ["idle"], "move.walk.right": ["running-right"], "move.walk.left": ["running-left"],
      "greet": ["waving"], "touch.head": ["waving", "happy"], "react.excited": ["jumping"], "error": ["failed"],
      "react.concerned": ["sad", "failed"], "react.sad": ["sad"], "rest.sit": ["waiting"], "wait.user": ["waiting"],
      "focus.working": ["running"], "study.review": ["review"], "emotion.focused": ["review"], "emotion.curious": ["look-row-9", "look-row-10"],
      "interaction.lift": ["picked-up"], "interaction.drag.left": ["dragging-left"], "interaction.drag.right": ["dragging-right"],
      "interaction.drag": ["drag-hold"], "interaction.drag.hold": ["drag-hold"], "interaction.release": ["falling"], "interaction.land": ["landing"],
      "rest.sleep": ["sleep"], "emotion.sleepy": ["sleep"], "rest.wake": ["wake-up"], "react.happy": ["happy"],
      "emotion.happy": ["happy"], "react.angry": ["angry"], "react.annoyed": ["angry"], "emotion.angry": ["angry"],
      "emotion.sad": ["sad"], "emotion.surprised": ["picked-up"]
    }
  },
  "interactions": {
    "hitboxes": [
      { "id": "head", "shape": "rect", "x": 0.18, "y": 0.02, "width": 0.64, "height": 0.42, "intent": "touch.head" },
      { "id": "body", "shape": "rect", "x": 0.14, "y": 0.36, "width": 0.72, "height": 0.6, "intent": "greet" }
    ]
  },
  "behavior": { "traits": { "activity": 1, "sociability": 1, "playfulness": 1, "sleepiness": 1 } },
  "presentation": { "defaultEmotion": "neutral", "defaultIntent": "idle" }
}
